tipus,szerzo,cim,vers,link
neg,Török Ignác,Könnycsepp,"Egy könnycsepp gördül az arcodon, Öröm vagy bánat, azt nem tudom, Csillan a napfény a könnycseppen, Ettől nem gördül könnyebben. Tükröződik benne a világ, Semmit nem tud rólad, ki lát, Te ismered a könnycsepp titkát. Most már mindegy, öröm vagy bánat, Megkönnyebbülsz, és ezt vártad. Megszárad a könnycsepp.",https://poet.hu/vers/381166
neg,Petrovics Gábor,Sírni akarok,"Sírni akarok! Üvöltöm. Sírni. Sírni! SÍRNI! De könny nem jön. Sírnék én, esküszöm! Sírnék, de nem tudok Sírnék érted balt meg?! De könny nem jön. Ha sírni sem tudok, Mondd. Mondd! MONDD! Fájdalmammal kezdeni, Mi a francot fogok?!",https://poet.hu/vers/380812
neg,Erdélyi Zsolt,Bukott angyalok: Harmadik írás,"Lehullott, mint hópihe egy fagyos éjszakán. Nem tudja, merre menjen. S biztonságot hol talál. Bolyong, mint havasi nyúl a tundrán. Hirtelen eső jelzi, merre jár. Mióta eszét tudja, nem látott fénysugárt. Hóvihar tombol, ha reszket. Olyan, mint egy árva gyerek. Keresi azt, kinél bátorságot lel.",https://poet.hu/vers/379314
neg,Beszterczy Koppány,A csillagok alatt,"Út van és szalad, és nem lát már semmit a csillagok alatt. Unta, hogy fáradt. Unta, hogy élve megeszi a bánat, hogy szeret és nem fáj, s ha fáj, akkor tompa. Unta, hogy fél, és hogy a levegőt rontja. Csak szalad, mert remél. (Megváltást remél.) Talán majd megváltva örökké elél.",https://poet.hu/vers/378528
neg,Tóth Gábor (Ess),Miért?,"Lágy és tüzes szellőként fogtad meg kezem, Félig direkt csak, de mégis elvetted az eszem, Úgy mutattad, én sem kíméltem a Tiéd, mert elvettem, És imádtad, hogy vidám szívemmel boldogan szerettem. Megvan az Igazi, úgy éreztem, életemben először, nyomban Hollywoodi volt az egész, Te utolsó sütim a boltban. Szeretlek, még most is, ezért nem tudom, hogyan éljek, Elhagyva, kidobva, lecserélve, miket nem tudom, mire véljek, Mennyek magasságából a hegycsúcs is nagy mélység, értem, De onnan egyenesen a pokol legalja, ahol földet értem, Ez a hely idegen még, s belül szaggat, gyötör, gyilkol és éget, Nem voltam elég, jött a tökéletes, ezután így még jobban égek. Nekik boldog ragyogás, amit ismerek, de nem a Miénk már, Nálam pedig a végtelen fájdalom, s szívemben maradandó kár, Tény, úgy alakult, aki akkor voltál, már többé nem létezik, Kimondom itt, most, az égi Élet az, mi ellenem vétkezik, Végtelen, sok kérdés, főleg, lehet-e ebből felállni valaha, Öregedő lelkem úgy érzi, épségben ebből... soha.",https://poet.hu/vers/378285
neg,Amirov Rusztem,A kislány egy mély kútba esett...,"A kislány egy mély kútba esett, És bár ugyan tudott úszni, De innen nem menekülhetett, Mert senki se tudta őt kihúzni! Hiába kért segítséget, Mert a vizet közben félrenyelte! A kút tetején nem volt vödör! - Kislány, mért jöttél a kertbe? A kút köré gyűlt falusiak Belebámultak a kútba. S a kisleányka elfáradt és Odalent várt fuldokolva. A hideg vízben békák úsztak, És a kislány sírni kezdett, Mert félt a haláltól a kiscsaj! - De hisz ez a kislány reszket! Ledobtak egy kötelet A markos, falusi legények. S a kislány belekapaszkodott. (Az anyuka nem hitt a szemének!) Felfele mászott a kisasszony, S a kútnak a tetején kimászott. Az anyuka feddni kezdte őt, És tudta a kislány, hogy hibázott! Vizes volt a kislány ruhája, Na, meg a nagy barna haja is! - Bocsánat! Mondta a kisleány. - Nincsen baj, anya majd hazavisz! Megszárította a lány haját, Aztán, hogy szép legyen, befonta. A kút száját örökre lezárták, És a sok öreglány befogta. Veszélyes volt ez a régi kút. Itt lakott ugyanis a Halál! S ő húzta mélybe a gyermeket. Csúszott a kislány a kút falán. Ez csak egy ördögi csapda volt, De betömték kövekkel a kutat. - Én csak a te javad akarom! Máskor majd fogadj szót anyunak!",https://poet.hu/vers/376875
neg,Papp Noel,Senkit sem érdekel!,"Sosem érdekelt senkit. Lelked sötétje, Mely minden nap egyre csak mélyebb, Kimászni nem tudsz, úgy folyton csak Körmöd téped. Segítség? Sosem kérted, minek? Ki segítene? A csöves, kinek rosszabb az élete? A barátod, akinek van sajátja? Vedd már észre, hogy magad vagy! Elmentek. Távoztak, kiléptek az ajtón, és - Fájt, mikor csukódott, szememből könnycsepp csordult. Még most is folyik, pedig már mióta. A fájdalom rosszabb, az idő gyógyít, mondta az idióta. Egy bizonyos idő után biztos. Bár lehet, sosem fog. Vagy majd másik életben, hol ezt már elfelejtem. Én - nem ezt kértem, hát pontosan ettől féltem! A jóistent kértem, csak őket ne. De őt se érdekelte. Magad vagy, vedd már észre!",https://poet.hu/vers/375959
neg,K. Anna,könnyeimmel főzöm a kávét,"felébredtem messze van az, mikor mondhatom, feléledtem ez már nem álom, dörzsölöm a szemeim eláraszt minden érzés sírásomtól a poharam megtelik még kócos a hajam ha tehetné, egész nap így maradna megfésülöm, aztán kontyba fogom kicsit ferde, de a napot így is végigtolom szemem bogara vörös az egerek ittak, látképem még ködös kiviszem a poharam ezzel tisztul szemem bogara felrakom a kávét benne van minden érzés, mit a lelkem átélt keserű, de mégis édes innen tudom, hogy életem valójában nem is olyan vészes",https://poet.hu/vers/375196
neg,Kecskés Dénes,Hangok,"Amikor két hang egymással szembefeszül, Vajon tudod, hogy a szív mit érez legbelül? Látod mindkettőben az aligátort, Keresed, de nem látod a moderátort. Szemedben könnycsepp vívja harcát, De nem mutatja igaz arcát. Az öröm vagy bánat lesz győztes, De nem Te leszel a vesztes. Mert egyszer elúszik a csónak, Vele Te is szebb vizekre evezel. Ahol a szeretet hangja mondja el: Légy oly`, mint Én, és minden jobb lesz, hidd el!",https://poet.hu/vers/373671
neg,Kismadarka,nélküled,nélküled én nem vagyok senki se nélküled nem találom a helyemet nélküled nem érek semmit se nélküled én nem élek utálok távol lenni tőled mert rájövök hogy semmit sem érek senkinek se lehet hogy te jól megvagy de én nem lehet hogy nincs rám se időd se energiád de nekem szükségem van rád egyedül vagyok teljesen legalább hallgass meg figyelj rám tartsd bennem a lelket kérlek érzem hogy valami hülyeséget fogok csinálni védj meg magamtól én nem tudok vigyázni magamra de te tudnál ha figyelnél és közben érzem hogy neked is szükséged lenne rám nagyon hiányzol mindennél jobban szeretlek még az életemnél is jobban kérlek csak beszélj velem hallgass meg figyelj rám én mindig itt voltam most te jössz kérlek most is legyél itt nekem,https://poet.hu/vers/372981
neg,Kismadarka,akkor miért?,"azt mondtad, mindent megbeszélünk! akkor miért mentél el? sohasem féltem még úgy, mint akkor, amikor utánad becsukódott az ajtó. féltem és remegtem, a falat ordítva vertem, aztán egyszer csak már ott voltál, és a két karodba zártál. nem tudtam, mit mondjak, így csak sírtam és sírtam, aztán végre megszólaltam: hiányoztál! de akkor is ott van bennem a kérdés, hogy miért és miért! hogy várod el tőlem, hogy beszéljek, ha te csak kussolsz? azzal, hogy elnyomod, nem segítesz, tudom, hogy megbántad és bocsánatot kértél, de ez nekem nem elég, nem felejtek ilyen könnyen! én elmondanám, ha tudnám, mi bánt, de csak ezt érzem, hogy nagyon fáj! nem tudom, mi az, és hogy honnan jön, csak azt érzem, hogy megőrülök! én szeretném tudni, hogy te hogy vagy, de abból mindig csak a baj van. nem tudom, mit csináljak, neked fel még mit kínáljak. azt érzem, hogy nem vagyok elég, de nem tudom, neked mi kéne még. nem tudok ennél többet adni, így is szinte nekem nem marad semmi. lehet, hogy valamit rosszul csinálunk, de közben olyan jól megvagyunk! nem tudom, mit kéne tennünk. lehet, hogy magunkkal kibékülnünk? minden esetre én nagyon szeretlek, remélem, soha el nem felejtesz.",https://poet.hu/vers/372752
neg,Varró Nándor,Könnyek nélkül sírni,"Aznap sírva aludtam el, Párnám ringatott, Másnap sírva keltem fel, Gyötrelmem fogadott. Másnap sírva aludtam el, Noha a könnyek nem folytak, Tegnap még boldog voltam, Mára viszont elhervadtam. Egy éve sírva aludtam el Boldogságom miatt, Akkor ismertem önmagam igazán, Ma csak egy bohóc vagyok. Sírva születtem a világra, Hogy örült emiatt a nép. Ma, ha sírok, könny nem csordul, Rabja önmagamnak, ez vagyok. Sírni fogok, hogyha tudok, Majd egyszer eljön az idő. Egy nap szeretni fogom magam, De addig még szenvedni fogok. Viharverte hajótörött Az élet tengerén. Megtaláltam lelkem A tenger fenekén. Lemenni nem merek, Félek, hogy megfulladok. De itt sem maradhatok, Félek, hogy soha meg nem gyógyulok...",https://poet.hu/vers/372323
neg,Papp Noel,Elveszettek,"Mit gondolok jelenleg? Szóba önteni nem tudom. Túl erős a magányom. Egyedül töltöm minden napom. Ilyen rossz ember lennék? Tényleg? Ezen segíthetek, egy tett ideje alatt eltűnhetek. Akárkinek mondtam, megtenném, Azt mondta, ne tegyem, van nekem itt helyem. Pont énnekem. Mind... mindenkit elvesztettem. 10 éves barátságot törtem. Több embert, kit szerettem. Ezt nem akartam. Most sírva eme sorokat írom. Közben agyam azon jár, életemnek véget vessek-e. Fiatal vagyok, persze. De ha egyszer ez így nem élet? Senkinek sem kellek. Egyszerűen, mindenben magam vagyok. Miért? Istenem, tiszta a szívem, szeretek, ölelek. Hibát követek, tudom. De mondtam már, hogy sajnálom... Bár lenne pár jó barátom. Kikkel csak nevetni lehet, s szeretni őket. E, N, Zs, K mind betűk, melyek már nincsenek. Ámbár rohadtul kellenek. Hiányuk fáj s széttép. Sosem lesz már az élet szép...",https://poet.hu/vers/371297
neg,Sütő Szilárdné,Fogd össze egy kupacba,"Fogd össze egy kupacba, És nevess arra az arcra, Ki a hazugot hazugnak nevezte, S ki az igazat se hitte, Annak, ki egyszer átverte, Fogd egy kupacra, Szorítsd a fogadat össze, Tartsd a levegőt bent, Három, kettő, egy, És fújd ki, ami mérgez, És ne kérdezz Olyat, amire válasz nem érkezhet, Fogd egy kupacra az érzelmet, Ami a napodra nyomja a pecsétet, A gombóc a torkodban addig fog nőni egyre nagyobbra, Míg végre le nem nyeled, ami a lelked fojtogatja. Érzések teljes tárházával, Keserű könnyek rejtett árjával Fogd egy kupacra, És dobd ki a szabadba.",https://poet.hu/vers/371187
neg,Pócsi Bianka,"Sírj csak, lelkem","Sírj, lelkem, sírj csak, könnyed mosdó, Bántalom szótlan, fájó, kósza, Szárnyalj a csendben, égbe zokogó, Választ keresve, ha sötét játssza. Tépj ki fájdalmat, rongydarabot, Így könnyebb a szív zarándokja, Emlék húzza a csodavirágot, De felcsillan a remény orcája. A sötétben keressük a fényt, Hol az éj árnya véget is ér, Sírj, lelkem, sírj csak, de nehogy hagyj tényt, Mint könny mögött ott rejtőző tánctér! Ne hagyd, hogy ő magával rántson, Hisz a bánatban is ott rejlik, Sírj, lelkem, sírj csak, de nehogy ártson, Ha a fény magában is levedlik!",https://poet.hu/vers/370604
neg,Maxa Mirella,Várt üzenetek,"Túlléptél, Jézusom, csak egy hetet vártál! Most akartam írni, hogy beszéljük meg. Ennyire nem kellek? Ennyire rossz lettem? ""Beszéljünk!"" - ordított volna az üzenet. Miről beszéltünk volna? Arról, hogy eltűntél magyarázat nélkül? Arról, hogy kerülsz minden ok nélkül? Arról, hogy nem érdekellek már, de nálam meg szakad az eső miattad? Oh, görcsöl a hasam, lassan 2 napja alig eszem miattad. Veled álmodtam, de te, gondolom, meg vele aludtál. Remélem, jól vagy, és nemcsak tested melegítésére használod őt is.",https://poet.hu/vers/365983
neg,Z_Generacio,Sok száz km,"Én itt vagyok, Te pedig ott, Elmentél messzire, S egyedül maradtam reggelre. Házam, városom, udvarom, fáim, virágaim mind ellenem fordultak, Idegen vagyok már az otthonomban. Utak, erdők, városok, folyók, mind távolabb sodor, Tudatom újra megfertőzi a búskomor. Várom, mikor térsz vissza, Gyermeteg gondolat bár, hisz boldog vagy te már. Bolond voltam, nem becsültelek eléggé, Barátságod volt a napfényem, amit magaddal vittél. Nem maradt más utánad, csak a sötét, Lelkemet, mint a szilánk, úgy hasítja szét. Minden másodpercben hiányzol, Álmaimban értem kiáltok. Ajh, most egyre csak azért fohászkodom, de jó lenne újraélni a múltat, Kijavíthassak minden rosszat!",https://poet.hu/vers/394087
neg,Kapocsi Annamária,"Köszönlek, tévedés...","Hogy mennyi mindent elmondtál nekem, mint vadak a földön, úgy hagytál nyomot, eső után. Vagy poros magányban terelt tivornyák vetítették hited paplanát. Pont úgy ágyaztál meg a világnak, mint nekem. Ó, minő boldogság. Vetett magjából kikelt a Tényleg, a megélt világtól köpött a föld. S hogy elébem sodortál, ej, ennyi karcot, miként is köszönjem, nem tudom már. Megmart, mi elért, ki tudja, merre, hová vitte, mit kiharapott. Kinek is volt jó? Mire is kellett? Tudhatnám talán? Nem! No lám. Nem ám. Hát köszönlek, áldlak, padlóhoz váglak. Kísérjen téged, kit gondolok még. S hogy szabadon menj hát, nem marasztallak. Mozdulatlanság legyen már gazdag, pont neked jár. Ne várj. Ne várj!",https://poet.hu/vers/394020
neg,Pierre Orlik,Hangos néma,"Némasági fogadalmat tett, De most felvisít... Rosszat nem érzett, nem nézett, De... most felvisít. Nem fáj neki semmi, Most mégis felvisít. Nem volt mit neki enni, Ezért felvisít. Mint íjjal meglőtt vad, Ki felvisít, Hangja pont olyan, Mikor felvisít. Nem bántottam, mégis... Miattam visít, Pedig ő csupán nem is él, Most még jobban visít, Nemlétező fájdalmában Egyre visít... A hang hirtelen abbamarad, Már nem visít. Leveszem kezem a korlátról: Nem visít A hideg acéllény...",https://poet.hu/vers/394010
neg,Kustra Ferenc József,Nem voltam én csak hajtó...,"Nem voltam én, mindig csak hátsó sori hajtó... Így aztán nálam üres maradt a szakajtó. Ott a vadászok mindig csak nagyvadra lőttek, Vadpörköltök az üstben mindig nekik főttek. Nem voltam kapzsi, Sem rámenős sohasem. Mindig sor végén álltam... Távol állt tőlem: Mohóság, haszonlesés. Bankszámlám üres maradt... * Vadásznak ropog a puskája, de szegény vad fegyver nélkül jött a világra. Nézem csak távolról a hajtást, a sok menekülő lényt, s nem gondolok másra: Vadásznak ropog a puskája, de szegény vad fegyver nélkül jött a világra. * Mindig ilyen peches voltam, soha nem tellett puskára... Nem lehettem vadász, így nem akadhattam ""vas"" nyomára. Pedig a sok nagyvadat én is láttam elégszer, Így tülekedtem, hogy lehessek hajtó még egyszer. Luxust, jólétet Csak távolból nézhetem. Balszerencse vagy pech ez? Szerencsém nem volt, Ám pech volt útitársam. Jóból nem sokat kaptam. * Mire vágyik az állat az erdőben, elgondolni is nehéz, kérdezd tőle... Talán eljön egyszer a nyugalom a Földre, s emberhálát ér az ő bőre. Mire vágyik az állat az erdőben, elgondolni is nehéz, kérdezd tőle... * A nagyvadak azóta sem haltak ki, Most is van még... lesz nagy vadász valaki... Megöregedtem, engem már hajtónak sehol sem vesznek be, Odafönt is az lesz, hogy belépek a hajtói... seregbe. Így idősen már Változni nem fog semmi. Fenn sem fog másképp lenni. Más már nem leszek, Földön s fenn az égben sem, Örök sorzáró leszek... * Egyszer meghalok, tudom, fentről figyelem a vadak sorsát, a vadászokat, Az örök vadászmezőkön kergetek majd nyugodalmas, szépséges álmokat... Egyszer meghalok, tudom, fentről figyelem a vadak sorsát, a vadászokat.",https://poet.hu/vers/393979
neg,Petri Agnes,Belátás,"A nosztalgia emlékké kövesedik, A fájdalom törtenetté hegesedik, A harag hallgatásba fordul, Az érzelmek amplitúdója csillapul. Nem tépődnek fel sebek, Az ember csupán elmereng, miért akarta megértetni szeretteivel az érthetetlent; elfogadni az élhetetlent miért kellett annyi év és idő? Miért magyarázkodtam, hisz szavak nélkül is érthető, Hogy már nem számít, elfeledted, mikor magunkra hagytak a felnőttek, egymásra vigyáztunk, árva az árvára, kétségbeesve, tehetetlenségbe zárva. Még sincs szavad. A múlt érdemtelen, vagy én lettem neked érdektelen, a magad útján járva gödörbe hánytad igazgyöngyeinket, közös emlékeinket. Temeted az eltemethetetlent, élő fajdalmainkra hordod rá a földet, ha nem szólsz, én is hallgatok, bennem dereng még kislány-arcod.",https://poet.hu/vers/393953
neg,Huber Alexandra,Nem ő vagyok,"Hiába mondom: nem vagyok ő, nem múlt vagyok, nem hazug nő. Én itt vagyok, te meg se látsz, mert benned még egy emlék ráz. Melletted fekszem, hallgatok, de benned más név ragyog. Hiába mondtam ezerszer, a szíved hozzá visszaver. Álmokba bújsz, ő jár feléd, és én csak nézlek némaságban rég. Én mentettelek, mikor fájt, most mégis ő az, aki benned szállt. De elég volt, már látni kell, hogy nem maradok emlék helyett. Én nem leszek egy másik árny, aki melletted lassan kihal már. Ha szeretsz, hát nézz végre rám, ne múltban élj, ne menj tovább! Mert én nem várok örökké, ha közben tört szúrsz belém. Több vagyok annál, mint aki tűr, aki a csendben nap mint nap lecsügg. Ha nem vagy itt, hát menj te is, de engem ne húzz le oda, ki nincs.",https://poet.hu/vers/393923
neg,Telda Flóra,Csendben?,"Csendben? Rendben! Maradjunk csak így, Nem is akarom érteni, miért, Nem akarok felejteni, Nem akarok nem emlékezni, Voltál, egyszer csak nem lettél, Hittél, egyszer csak elvesztél, Dobozok hevernek mindenütt, Üres falak, polcok, Mintha látnám a volt képek Árnyékát fent a falon, Mintha bejöhetnél az ajtón, Nem akarlak elfelejteni, Várom, hogy egyszer majd itt leszel, Hogy újra meséled, mi hogy történt rég, Nem akarlak elfelejteni, Emlékeim halványulnak, Szemed színe milyen volt? Ragyogó, nem vitás, De ki is mondana mást, Talán ha nem beszélünk róla, Akkor majd jobb lesz? Akkor majd elhisszük, hogy még itt van? Hallgattok, régen még voltak mesék, Rég kiszínezett családi történetek, Most már csak csend, Nem akarlak elfelejteni...",https://poet.hu/vers/393890
neg,MikRobi,Törött lélek,"Összetört egy lélek, lent fekszik, ott mélyen. Nem hiányzik senkinek, nem szolgál már semminek. Kidobták őt, mint egy rongyot, mint kutyáknak a rossz csontot. Szétvagdosták karddal, késsel, szétvagdosták, mert már nem kell. Eldobták, mert jól elfogyott, túlhasználták, és elkopott. Kifacsarták az erejét, megszüntették a szerepét. Ő már többé nem létezik, ha hibázik, nem vétkezik. Minden, ami volt, már nincsen, pedig ő volt az én kincsem. Szegény lettem, nem találom, várnom kell hát a halálom. Hosszú lesz az lélek nélkül, egyszer úgyis eljön végül.",https://poet.hu/vers/393866
neg,Szûcs Gergő Senkihangja,Belső gödör,"Hirtelen jött öröm köszönt, Kötött kölyök dörgött s köpött, Ökör-körök, lökött rögök, Vörös küszöbön pörgő dögök. Szökött közöny söpör s pöröl, Ördög döngölt börtön-gödör, Különös sömör, büdös csömör, Görcsös jövőt nyögő gyönyör. Zörgő, hörgő, döntött vödör, Közös ügytől törött tükör, Könnyet törölt tömör ököl, Közös közegbe döfött tőr.",https://poet.hu/vers/393834
neg,Biró Ferenc Fredok,A szerelem halála,"Fölém hajolt a szomorúság árnya, akár a fűzfa minden gyenge ága, borús szívemet jégbörtönbe zárta. Szerelmed hiánya messze üldözött. Rideg, fagyos, Ezüsthold háta mögött lebegek két szomorú csillag között. Szemeim előtt a látvány dermesztő: Fehér ködfátyollal takart temető sírboltjánál egy gyászoló szerető.",https://poet.hu/vers/393813
neg,Polla,Mikor van szükség rám?,"Én melletted állok, Te valóban itt vagy? Az életem érted adom, Te mégis itt hagysz. Szükséged van rám? Engem ez éltet... Mindenem feladnám, Másért nem, csak érted. Mikor leszek értékelve? Mikor látsz meg engem? Kezem teszem a szívemre, Elég volt belőlem?",https://poet.hu/vers/393810
neg,Benkõ Csilla,Befelé,"Két lélegzet közt a forró beton képe. Ott mélyen volt kijárat, De rossz helyen a korlát. Talán elvitték volna a madarak, Mint lelket, ha rebbenti szárnyát. A Nap mögé elbújni. Aztán a ráncolt arcú bánat Úgy járt utána, mint árnyék. Két lépés között az ajtók kattanása. Levegőtlen, rémült rohanás. Kijárat nincs. Hát befelé, csak befelé... Poshadt vizű emlékek közt Elbújt egy hiány, Eltűnt egy lyuk. Egy kút kiáltott, visszhangja néma. Nincs itt semmi, mondták. Mégis... Valaki van, valami van. Van. Van. Van kijárat. Mélyen. Csak befelé.",https://poet.hu/vers/393807
neg,SzilágyiZoltán,Hiány árnyékában,"Az éj sötétje lassan rám borul, A múlt zenéje bennem elcsitul. Csak emlékednek halk, fakó szava Kísér az úton, hol nincs már haza. Hiányod bennem égető sebhely, Mint tépett ág az őszi szél kezén. A csendben hallom minden halk zaját, De nem találom hozzám szóló szád. A holdvilágnak árnya rám hajol, Az idő fut, de minden fájdalom Újabb lánccá lesz, melyre fűz a kín, S a tegnap íze mar, akár a kín. Az arcod éget, bár már messze jár, Mint halvány csillag, mely az éjre vár. Ha lehunyom szemem, még látlak én, De könnyem hull a múlt kövén, kemény. S ha egyszer eljön végső alkonyom, Talán majd ott leszel a partokon, Hol nincs hiány, csak fény és otthonok - Addig az emlék szívemben dobog. A nap ma fázik, nincsen sugaram, Csak árnyék ül a néma utamon. Az üres percek kongnak, mint harang, S a csendbe fúl az elhalt hangzavar. Már nem remélek, csak emlékezem, A múlt szilánkja vágja szívemet. Kérdeznék tőled, de nincs felelet, Csak csillag írja rám a fényeket. Az álmok őrzik halvány arcodat, A hajnal hozza újra gondomat. Hiányod szúr, mint téli dér a fán, És minden út a semmibe talál. Az idő foglya lettem én veled, A percek húznak, mint a lánc neked. De nem engedlek, míg dobog szívem, Az emlékedből épül mindenem. Ha hallgatok, még hallom hangodat, Ha sírok, érzem minden könnyszavad. A szélben néha érint kezed árnya, De tovatűnik, mint víz a pohárba. Majd egyszer, messze, hol az ég kékebb, Megint találunk, mint a fény képe. Ott nem lesz könny, se árnyék, semmi kín - Csak fény leszel, s én benned örökkén.",https://poet.hu/vers/393713
neg,Huber Alexandra,A múltból jöttél vissza még,"Hiányzol, bár már messze vagy, időnként szívem beleszakad. Azt hittem, elfelejtettelek, de nem, még mindig fájsz a lelkemben csendesen. A nyár, a szó, a régi kép, egy mosolyod bennem még szép. Azt hittem, túl vagyok rajtad rég, de minden emlék visszalép. Nevettünk, sírtunk, volt remény, most csak az űr jön szüntelen énfelém. Hiányzol, s bár nem mondom ki, a szívem nem tud nyugodni. A múlt nem múlik - bennem ég, nem csitul bennem az emlék. Azt hittem, elfelejtettelek, de nem, örökre ott vagy a szívem rejtekén, mélyen, benn.",https://poet.hu/vers/393692
neg,Józsa Bence,Elvesztettem,"Elvesztettem a fonalat, igen, Azt a vékony, szinte láthatatlan szálat, ami összeköt minket minden élőlénnyel, minden gondolattal, minden reménnyel. Elvesztettem a fonalat a betondzsungelben, ahol a szívből jövő nevetés ritkább, mint a mosoly a reklámok bódult szerepelőinek arcán. Ahol a szemünk üres, a fülünkben a zaj, a torkunkban a kimondatlan szavak. Elvesztettem ott, ahol a tökéletesség illúziója áraszt el. Ahol a lájkok számolják az értékünket, ahol a valóság elmosódik minden egyéb mögött, mert ki vagy Te, ha nem posztolod!? Mert ki vagy Te, ha nem követnek!? Mert ki vagy Te, ha nem vagy elég!? Elvesztettem a fonalat a munkahelyen, ahol a cél nem az alkotás, hanem a profit! Ahol a lélek eladva, a kreativitás elfojtva, a boldogság egy távoli álom, mert a rendszer nem akar ilyen embereket, csak engedelmes robotokat. Viszont... Van egy aprócska remény, egy kis szikra a sötétségben, egy érzés, hogy talán mégis meg lehet találni azt a fonalat, nem a régi megszokottat, hanem egy újat, erősebbet, színesebbet. Ami nem a társadalom elvárásaihoz köt, hanem a saját szívünkhöz. Egy olyat, ami nem a külső csillogásra épül, hanem a belső értékekre. Egy olyat, ami nem a fogyasztásra ösztönöz, hanem a teremtésre! És talán... Ha elég sokan keressük, ha elég sokan merünk másként gondolkodni, ha elég sokan merünk élni, akkor újra megtaláljuk, és megismerjük az élet mikéntjeit, nem a tankönyvekből, nem a hírekből, hanem a saját bőrünkön, és talán akkor végre úgy igazán szabadok leszünk...",https://poet.hu/vers/393680
neg,Steffel Csaba,200,"Tudtam, neked száz, és talán nekem is... Tudtam, neked száz... és hinnem kellett, hogy nekem is. Ez van, hazudtam magamnak, mégsem dőlt rám a ház. Ebben élek azóta, s morzsolgatom magamban, száz és száz... Volt, amikor bénán hittem, ha kimondom: Száz, akkor százszor szép lesz ez a bujkáló álom, vagy legalább szebb, mint ez az átkozott mámor. Most meg virágos rétet álmodok, szépet... félek. Argosz vigyázott rám száz szemével, mikor árkádok száz kövén vonszoltam pihe lépted után magam, s magammal tétova döcögő énemet. És még mindig itt vagy, vagy ott, százfelé nézhetek, gyakran felszáll sóhajom, vagy inkább csak egy fojtó lélegzet. Néha megvillan egy apró napsugár, rám ragyog, tudom, éreznem kellene, hogy még vagyok, vagy ok nélkül vagy nekem még mindig eszemben... ...s eszem szívemben.",https://poet.hu/vers/394026
