tipus,szerzo,cim,vers,link
poz,R. Rácz Péter,Velem,"Közel vagyok, minden közelébe`. Bezárva a mindenség egébe. Talán csak én fénylek igazán itt, Mert minden velem együtt történik. Velem jön el a tél is, az ősz is, Virágzik és megsárgul a kőris, S amikor a szél csenddé szelídül, Feleszmél a nyár, és megsemmisül. Velem van a hétköznap, az ünnep, Velem zokognak, vígan örülnek, Megtalálsz az erdőn, völgyön, réten Szikrázó nappal és vaksötétben, Nem vagyok nyom, mit írtak végtagok, Megvagyok s érzem: minden én vagyok. Fellegek közt fény csókolt a földre, Szürkeséget varázsolva zöldre.",https://poet.hu/vers/392012
poz,Magyar Magdolna,Bizalom,"Nyúztuk, húztuk, vontuk Örömmel, bánattal, Dalolva, könnyezve, Vágtázva, döcögve, Harcolva, megbékélve, Hittel kibírva, Szabadságunkat nem elárverezve. Elszállt... Új generáció, Öregek, Ti is Mind, akik éltek a Földön, Látva, értve mindent Ne féljetek, bízzatok! Már közel a szellemi Világosság. - Akár megéljük, akár nem, Isten igazsága győzni fog!",https://poet.hu/vers/392008
poz,Tengeri Szépia,Mikor ér valami véget?,"Mikor ér valami véget? Ha kétségbeesetten keresed, hogy miért csinálod az egészet? Vagy ha már kiégett a lélek? Vagy befejezheted hamarabb, mert ez a szabad akarat? És honnan tudod, hogy jól döntöttél, kitartsál vagy meneküljél? Meddig vagy küzdő, reményteljes, s mikortól naiv, önmagadra veszedelmes? De végre döntöttél, és a döntéssel szabad lettél. Már nem tervezel, nem küzdesz, nem felelsz meg. Még sírsz, de már mosolyogsz a könnyeiden át. Már nem akarsz szétesni, s a sejtjeidben érzed az összetartozást. Már nem lüktet az agyad, a szíved lassan piheg. Legnagyobb szövetségesed magad vagy, s tudod, a jövő benned pihen.",https://poet.hu/vers/391923
poz,Yelchowt Elisabeth,Beléd égtem,"Szemerkélő esőben állunk kint kettesben. Esernyőnket nem nyitjuk, s a naplementét csodáljuk. Egymást nem is sajnáljuk, hagyva a szót, hadd szálljon. Nem kell tovább váratnod, ítéletét elhagytuk. Komolytalan arcodon, komolyságod láthatom. Ártatlanul pislogsz most, bár ajkad élve tépne húst. Kegyetlenség árad szét, de fájdalmasan jó e kép. Elfelejtett igaz lét, kegyelmes vagy, nem kérdés.",https://poet.hu/vers/393517
poz,Riczu Joli,Sanszos,"Rám kacsint a reggel, útnak indulok. Ebből a napból bármit kihozhatok. Nem fúj a szél sem, felhő sincs az égen, a nap ragyogva nevet, ma egy új sansz lehet. Jó történik velem, felemelem fejem, nincs bennem kétely, a mai nap kivétel. Utamon kísér mosolyom, derűs kedv és nyugalom. Tudom, ez az én napom, jó kedvem el nem hagyom. Szembe jönnek emberek, mosollyal felelnek. A nap ragyogva nevet, ma egy új sansz lehet. Ez a nap a legjobb, nem lehet, hogy elrontsd, mindent kihozok belőle, nem leszek letörve.",https://poet.hu/vers/393399
poz,Szabó Rezső Tibor,Ki ne szeretné...,"A friss elme még frissüljön! Ami erő, erősödjön! Ami velős, velősödjön! Ami derűs, derűsödjön! Ami munka, megtérüljön! Ami pörge - kalapodjon! Ami egész - `ségesedjen!",https://poet.hu/vers/393303
poz,Fadre,Két háromsoros,Szólt a kacsa libabőrös lett az egész testem a sok álhír hallatán Fehér szárnyak két fehér szárnnyal nemcsak az angyal szárnyal biz` a liba is,https://poet.hu/vers/393252
poz,Pete Margit,Békabánat,"Szél kergette fellegek, béka ugrál, kesereg: Nem ettem ma eleget! Hogy kapjam el a legyet? Bekapnám, de tovaszáll, szúnyogéknál vizitál! Üres szájban békanyál, de keserves ez a nyár!",https://poet.hu/vers/392749
poz,Merx Ildikó,Árnyék,"Felettem a napsugár Lángolva jön, meg nem áll Jön velem az utamon Attól fél, hogy elhagyom",https://poet.hu/vers/392110
OFF,Tóth Tünde,Az irodalom háztartási balesetei - Minieposz,"Fejemben pörögnek a metaforatárcsák, spontán jön a lendület, játékos csapongás. Szikrázik az irónialézer, verset kéne írni, de a végén porrongy repül a levegőben, nem a konfetti. Mint amikor a kenyérpirító próbál Shakespeare sütit sütni, a versszerkezetet már csak az ipari palacsintasütő tudná összefogni, és azt is csak akkor, ha beleírják a SWOT-analízist. A szófűzés olyan, mint amikor rétest nyújtanak, rád csavarodik, de eközben elszakad, hiába a szinesztéziás érzések irányítanak, ha a gondolattérkép GPS-e bemondja az unalmast. A verssorok elszabadult bevásárlókocsiként gurulnak, a rímpárok egy turkáló öltözőjében vitatkoznak, irodalmi barkácshumorok csavarokkal kacérkodnak, ínycsiklandozó szóképfalatokkal abszurd tálcádon sorakoznak, majd, mint egy versformájú jóllakott lufikutya, a képek előtted hirtelen szétdurrannak. A képzavar az ajtódon dörömböl, és szőnyegként kezdte árulni magát a nyelvtani piacon, mielőtt betört. A csattanó egy másik versben robbant, de eljött bocsánatot kérni, a hasonlat annyira túl volt írva, hogy már saját influenszer-karriert kezdett, mint ""MetaforaNéni"". A lírai narrátor elment szabira, helyette a konyhai időzítő állt be verset írni, 3 perc múlva csipogva egyeztetési hibába botlott, s múlt időben próbálja a jelent visszahívni. A rím végén a kérdőjel csak áll, mint szkeptikus postás, ""Jó helyre csengettem? Hogy fogom én ezt helyrehozni?"", majd úgy kúszott a sorokba, mint eltévedt macska a színházi főpróbán, nem volt betervezve, de örült neki mindenki. De a versív oly mértékben rogyott meg, mint egy IKEA-polc, amit használati utasítás nélkül érzékkel szereltek össze, a rím úgy tekert balra a sor végén, mint nagyszülő ki nem tudta, hová tart a pláza foodcourton át, mert elfelejtette, olyan összevisszasággal repkedett tovább, mint egy összeesküvés-elmélet powerpointban felolvasott szonettje. A lírai én szabadságra ment, helyette az irónia ügyelt a házra, mint egy szabadon garázdálkodó szinesztézia, a sorok úgy csúsztak egymás után, de nem baj, mert fantázialisztből még van bőven a kamrában. A verscsattanó megérkezik, de rossz lakásba csenget, a szöveg nem táncol, inkább csak billeg, a hasonlatok egymásnak feszülnek, egy IKEA-bútor leírásából próbálnak szabadulni a rímek, a vers ihlete úgy jött, mint egy postás, mely mindig kétszer csönget, miközben a hasonlat egy próbafülkében rekedt, a versszakok lógnak a sorok végén mint elázott zoknik, mik sosem száradnak meg. A szókép annyira túlbonyolította magát, azóta egy nyelvtani tanácsadóhoz terápiára jár, egy beragadt metaforadobban nem bírta leállítani az abszurd centrifugát, mint egy kikapcsolt mikrofon egy slam poetry estén, válasz nélkül állt, pedig a lírai önreflexió bekapcsolta a kreatív vízforralóját. A sorvégek közös nyílt levelet küldve fellázadtak, elegük volt a csattanókból, saját identitást akartak. A rímstruktúra elaludt a mondatok végén, és horkolva ismételte a szótagokat, az allegória önmagát próbálta magyarázni, de három hasonlat után már a metafora rehabra rohant. De te csak dőlj hátra, hogy a képeket élvezettel kanalazd, és hagyd, hogy a kreatív kanapéd nyikorogjon alattad. A ritmus átváltott szabadversbe, de még mindig karmestert keres, a stilisztikai konferenciáról biztonsági őrök vezették le, mert a szóképe túl kreatív lett. Mint egy elhasznált pódium, úgy dőlt össze a vers szerkezete, látványosan, recsegve, kifáradva írt ezután táppénzes verseket egy újrahasznosított papírfecnire. Hátuljáról tör elő az ihlet, mint egy eldobott bevásárlólista, mely a májpástétomot elfelejtette, míg az alliterációk egymással viaskodtak. Azóta is K-betűs káromkodásban veszekednek, és saját magukat idézik poszmodern grimaszt vágva a tükörképüknek. A verstéma passzív-agresszíven néz a sorok közt megsértődve, mert hogy a főcím nem ő lett, azóta is képeslapokat küld szinesztéziából egy használaton kívüli alcímbe, mert inkább nyaralni ment. A befejezés a vers végére nem érkezett meg, most egy láthatatlan irodalomtanár keresi egy eltévedt lábjegyzetében. Játssz a nyelvvel, légy az író, olvasó, a szerző és a díjátadóbizottság, tedd hozzá az iróniakeverőd, mint egy képzavarszakács. Az sem baj, ha hangzásra olyan, melyet egy csöpögő csap ihletett, vagy mint egy posztmodern versgyűjtemény (vagy hiányzik belőlük az utolsó csavar: a poén) melyet egy forró vasaló poénrétegre égetett. Mikor lángra lobban a metaforatálcád, az abszurd képek frissen szervírozva jöhetnek. De ki szatírában főz, az viccekben tereget, a metaforagyár szalagján bizony képzavar is felléphet, sántító alliterációival nyelvi lasagnává keveredhet, majd ha elfelejtetted kivenni a sütőből, meg is szenesedhet. Vagy mint amikor fél pár rím és egy túlfűtött metafora összeházasodik a mikrohullámú sütőben, a végeredmény olyan lesz. De ahogy egy igazi posztpoétikai eposzhoz illik, hagyd a versed kiforrni, buggyanni, fortyogni, majd állj elé izzó képzavartányéroddal és kritikai szalvétával, mikor a háztartási irodalom új alfája megszületik a kanálcsaták románcával. Lekváros képek, vajas metaforák, mind képzavaromban sültek de ha a mosolyod ettől sem rezdült meg, visszavonulok a szinonimatányéromhoz becsokizni, mindent, mit itt sorra kifőztem. (Talán nem kell kétszer megemésztenem) És ha így végére beletolatott a nyelvtani bokorba, mert nem ért célba a gondolatmenet, én visszavonulok - nem megsértődve, ha eddig egy mosoly sem született, mert a lekváros mondatok csak a kenyérhéjak szegletében zizegtek, ha nem nevettél, sebaj, néha a kigyúrt kelt tészta is sülve összemehet. Ha bármikor kedvet kapsz egy kis nyelvi agyraguhoz vagy egy csattanós szóviccgulyáshoz, rögtön öltözz be köténybe, süsd meg akár a mikrohullámú sütődben sült alliterált metaforás sütid, és rakj rá egy málnaszelét, mert jól mutat, na, meg ha a rímképlet is sántít, nem baj, ha paleolit, vagy ha a sütőben akár örökre bent ragad, mert még túl forrón vennéd ki, hiszen az alaplé vagy egy nevetés közben megzavart... Tudod, a ritmusok, képek áramlása pont olyan, mintha egy agyi konyhamalacba öntöttél volna iróniát, szókép port, irodalmi porszívót és egy tegnap otthagyott metaforát, ne érdekeljen, más mit mond, ha a te ütemedre kattogva lett összedarált, ha úgy érzed, az lett a legízletesebb befejezés, mit valaha írtál, és ha olyan, mint amikor egy kicsit megégett, de annál karakteresebb kalácsszél alól előbújik a diógrillázs, vagy picit kilóg érzésre, mert hosszúra nyúlt benne a textúra, illat, csattanás, pörgesd tovább a háztartás műfaj humor turbómotorját, epikusabb, mint egy metaforaszivárványra hajtó mosógép ötödik fokozaton, ha van még hely a serpenyődben, lökj hozzá még szóképes szalonnát, meg poén-granulátumot, irodalmi légpárnás járműved lesz, ha ezeket mind beledolgozod, bármi is süljön ki belőle, én emelem előtted kalapom.",https://poet.hu/vers/391897
poz,Pődör György,Tó partján,"Zöld mezőben kicsi tó, hangulata csitító. Füves partján virágok színezik a világot. Szép szirmukra lepke száll, mézre szomjas nyelve már. Megy a tavasz jön a nyár, Nap is ravasz, körbe jár. El-el bújik felhőben, forrót lehel szellőben. Aludni tér: - hova hát? Csillag tudja, odalát.",https://poet.hu/vers/391563
OFF,Sólyom Gábor,Ki kivel van és miért?,A holló mesélte Hogy a farkas letépte Majd a rókának adta Ki a medvénél hagyta De mikor lelépett A borz pont belépett Látta az egészet És hívta a menyétet A menyét a sünnel Túl hirtelen tűnt el Egy vasárnap este Még látta a fecske Amint egy fa alatt A pocokra ugranak S miközben elverik A hermelint éltetik A sün persze tudta A menyét hova dugta Szólt is a nyúlnak Hogy mindent lenyúlnak És a vakondra fogják Mert róla tudják Hogy annyira más Hisz mindent elás De közben a menyét Szintén nem henyélt Csörgette a struccot Hogy vigye el a cuccot Ha lehet jó messze De ügyeljen a nyestre Mert bár nem látszik Mindig nagyban játszik Távolabb az ürge Ledőlt a fűre Viszketett a marka Mikor rászólt a szarka Hiába vársz a bérre A nyest le van égve A léből nem lesz semmi A történet ennyi.,https://poet.hu/vers/391545
poz,jank,Vakáció,"Harsány színekkel mosolyog a nyár, szellő szárnyaival integet: ""Jöjj hát, komám, tied a világ, barangolj erdőn, füves réteken."" Neked kürtöl a vonat kacagva, a tópart is csak reád nevet. Rád mosolyog a pattogó labda, a sok gyümölcs mind néked terem. Halihó! Vár rád ezer vidám kaland, a vakáció szép, derűs hetei. A sok vidám cimbora lankadatlan jókedve gondodat elfeledteti. Mióta vártad már epedve, hogy átöleljen a forró napsugár. Lested a naptárt, s most repesve kiáltod: Itt a nyár, végre itt a nyár! Egy időre a némuló sulit itt hagyod. De emléke talán veled marad. Öröm, küzdelem, móka, barátok nem tűnnek tova nyomtalan. Harsány színekkel mosolyog a nyár, szellő szárnyaival integet. Egy darabig most nem hív iskolád, de visszavár, vár rád, mert szeret.",https://poet.hu/vers/391536
poz,Szuda Melinda,Kakas Ferkó és a szelfi,"Előzmény: Kakas Pityu Kakas Ferkó nagyon szép kakas volt, egész nap a tükörben magát nézte, csodaszép volt a tolla - De szép is vagyok! - Mindig azt mondta. Aztán egyszer kapott egy telefont, hű, ekkor nagyon boldog volt, csinált magáról sok-sok szelfit, ami mindenkinek tetszik. Kakas Ferkó nagyon sikeres lett, sok barátot szerzett, felmentek az internetre, fácán Peti volt a legjobb barátja, azóta a szelfiket vele csinálja!",https://poet.hu/vers/391484
OFF,Ibolya Lakatosné Bungó,Vizsga után (morzsák),"Fergeteges hangulatba`, Betértünk a kiskocsmába. Tölgyes tanszék lett a neve, A hallgatók kedvenc helye. Folyt a ""Pepsi"" és a sok szó, Mindig volt igazságosztó. Vizsgaélmény, diák szava, Sok-sok színes változata. Mert mindenki másképp látta, Csiszolódtunk egy hullámra. - Átmentem egy rossz kettessel, Nem lettem okosabb semmivel. - Megadta az egyest mára, Visszatérek randevúra. - Azt sem tudom, mit kérdezett, Tudatomig nem érkezett. - Beírta, hogy ""elég"", és aztán kérdezett, Torkomra innentől egy szó sem érkezett. Mégis ""séges"" lett a vége, A Tanár Úr örömére! - Öt fogalom nem nagy dolog, A témában el is mondod. ""ISMERET"" volt ismeretlen, Kezem gyorsan a kilincsen. - Nem tetszett az új frizurám, Meghökkenve mutat reám. Rendezetten kíván látni, Akkor fogunk szóba állni. - Bármit mondtam a témában, Egyiknek sem örült jobban. Felhívta a figyelmemet, Olvasgassam a könyvemet! - Velem póttételt húzatott, Lelkemben mély nyomot hagyott. - Nincsen index, nincsen jegy sem, Kiborultam, hazamentem! Szemelgettünk, cseverésztünk, Záróráig mesélgettünk. Lelket öntöttünk egymásba, Vártunk egy szebb virradásra!",https://poet.hu/vers/391219
poz,Gy. T.,Tíz perc,"Tíz percig zöldben láttam a napot, Szépsége szemembe ragyogott. Mosolygott. Mosolyogtam. Tíz percig zöld erdőbe fújt a szél, Ajkáról a röpke csend beszélt. Hallgatott. Hallgattam. Tíz percig szabadon járkálgatott, Ismeretlen érzet áramlott. Lépett. Léptem. Tíz percig elengedte gondolatait, Kinyitotta megkötözött szárnyait. Elrepült. Elrepültem.",https://poet.hu/vers/391195
poz,Kiss Virág Liwet,Napsugár,"A város szélén, ahol a nap fénye szelíden csillan, lágyan suttog a szél egy édes dalt, mit sosem feledtem. Keleten már ott ragyog a hajnal, mint vásznon az olaj, a pillanatban együtt repül a lelkünk ihletetten. A szívem, mint egy zöldellő térkép, új utakat keres, a titok, amit csak Te tudsz, minden sorban, minden versben. Szerelmem vagy, színes mozaik, mit az élet összerak, és én úgy érzem, hogy szavaid színek a rózsakertben. A pillanat hozzád ér, ahogyan szavam veled marad, mint egy fényes csillag, megvilágítod nehéz utamat, mert a szerelmem vagy, dallamom és a szívverésem, ahogy a költők, versben írom neked a napsugarat.",https://poet.hu/vers/390884
poz,Voodoo,Veled édes,"Odakint... esik megint, a bőrömön érzem az esőcseppek ritmusát, fekete-fehér, mozdul a kéz s a száj, veled édes a csend, nélküled fáj! Ma éjjel... felhők mögött ül a Hold, a sötétben szinte fuldoklik a táj, árnyak lesnek rám minden sarokból, a házba csalta őket a félhomály. Ráadásul álmom is cserben hagyott, s ha ez sem elég, jéghideg az ágy, pedig közben újra erőre kapott, s vígan lobog kandallómban a láng. Elvarázsol, mint máskor, ha felragyog, de már minden gondolatom messze jár, álmomban egy perc alatt nálad vagyok, akkor is, ha ködbe vész a láthatár. A zene mindig segít, csak pár akkord, néhány hang, ami lágyan tovaszáll, és máris velem vagy, hogy velem dalold legszebb dalom, szerelmünk himnuszát. Odakint... esik megint, de idebent... nem az eső áztatja el a kottám... Összefolynak rajta a hangjegyek, de azért nyitva hagyom a zongorán, míg alszom, magától játszik tovább... Hiányod könnyével alszom el, ám reggelenként mosolyogva ébredek, ha rád gondolok, menekül a magány. Látod, máris hogy csillog a szemem, ma még az ég is velem sír talán, érzem a bőrömön az esőcseppeket, ahogy koppannak a szobám ablakán. Szomorú dallam egy bús éj hajnalán... Sokan nem értik a férfikönnyeket, legtöbben tagadjátok, ha rákérdezek, persze, te is sírsz, ahol senki se lát... Ezek amúgy is boldogságkönnyek, már rég begyógyultak a sebek szívem falán. A holnapom vagy, új jövő, s új világ, szerelmünk magjából kihajtott virág! Én fekete pillangóként repkedek, aki éppen hófehér szirmára száll... Ez jár az eszemben, s bármit teszek, úgy tűnik, átvirrasztom ezt az éjszakát... Játszom hajnalig, vagy akár még tovább, sosem unom meg szerelmünk dalát, fekete, fehér, mozdul a kéz s a száj, veled édes a csend, nélküled fáj!",https://poet.hu/vers/390857
OFF,Majszterics Vanessza.,"Most, amit érzek","Már minden halott körülöttem, És én mégis várlak. Beléd öltöttem ezeregy árnyat, Kérlek, keress meg, és beszélj velem, Nélküled üres a hetem. Sóvárog utánad keserves szívem, S mikor itt vagy, már nem is emlékszem. Nem emlékszem a gyötrelmek ízére S lelkem lelketlenségére, Miért van az, hogy minden elcsesződik, S miért van az, hogy ez az egész megőrjít. Akarlak, de nagyon és semennyire, Mert ha itt lennél velem, talán nem menne ennyire. De, oh, Istenem, ha itt lenne, talán működne is, S addig lennénk egymás végzetei, míg el nem veszik. Bár ugyan képtelenség, hogy elvesszen a gyönyörű képlet, Mert téged nekem, s nekem téged Így szántak egymásnak a földi lények.",https://poet.hu/vers/390747
poz,Takács László (Taki),Pálinkadal,"Pálinkára felesküdve Tiéd lehet feles üdve, A gyümölcs esszenciája Lepárolva a flaskába. Vár a nemes Hungarikum, Barack, szilva és unikum, Igaz, ez utóbbi likőr, Az is éget, több hát, mi köll. S mikor fekszel már kiütve, Ész és gátlás ment a füstbe`, Nem kell gondolkodni többet, Nincs is mivel, agyad töppedt. Persze, lehet kulturáltan... Edzésbe` vagy? Igyál bátran! Nem lesz tőle semmi bajod, Gyakorolta már a fajod. ...de ha olyan vagy, mint én, Oly gyakorlatlan, Maradj meg egy gyűszűnél A gyakorlatban! ...és most, ha van kedvetek, énekeljétek velem az Illés Együttes: Az utcán dallamára! Pálinkára felesküdve Tiéd lehet feles üdve, A gyümölcs esszenciája Lepárolva a flaskába jó... Így áll ez Pali, de Pali, de Pali, de Pali gyerek, Pali, de Pali, de Pali, de Pali gyerek, Pali, de Pali, de Pali, de Pali gyerek, jó... Vár a nemes Hungarikum, Barack, szilva és unikum, Igaz, ez utóbbi likőr, Az is éget, több hát, mi köll még... Így áll ez Pali, de Pali, de Pali, de Pali gyerek, Pali, de Pali, de Pali, de Pali gyerek, Pali, de Pali, de Pali, de Pali gyerek, még... S mikor fekszel már kiütve, Ész és gátlás ment a füstbe`, Nem kell gondolkodni többet, Nincs is mivel, agyad töppedt már... Így áll ez Pali, de Pali, de Pali, de Pali gyerek, Pali, de Pali, de Pali, de Pali gyerek, Pali, de Pali, de Pali, de Pali gyerek, már... Persze, lehet kulturáltan, S ha edzésbe` vagy igyál bátran, Nem lesz tőle semmi bajod, Gyakorolta már a fajod rég... Így áll ez Pali, de Pali, de Pali, de Pali gyerek, Pali, de Pali, de Pali, de Pali gyerek, Pali, de Pali, de Pali, Pali gyerek, rég... Kinőtt téged már a bölcsi, Italod sem édes tejcsi, Mondd: Nem vagyok Pali gyerek, Mostantól Pál inkább leszek én... Igyál hát Pali, de Pali, de Pali, te fenegyerek, Pali, de Pali, de Pali, te fenegyerek, Pali, de Pali, de Pali, te fenegyerek, rég...",https://poet.hu/vers/390381
OFF,Zanner Anikó,Elsuhant ihlet,"Elhagyott az ihlet, elment jó messze, elsuhant szellő szárnyán valamerre. Érzem, hogy valamiről kellene írni, de a szavak kuszák, velük nem bírni. Írnék, de még a rímek is megszöktek, nem tudni, vajon merre rejtőzködnek. Kezem a billentyűzeten, gondolkodom, de a gondolat is elszállt: így hagyom, mert akárhogyan igyekszem, ebből már vers nem lesz: repülj hát, vár a lomtár. Amikor újra visszatérsz hozzám, ihlet, majd pörögnek a szavak, a szép rímek. Akkor már fogom tudni, miről is írjak, a szóvirágok is könnyedén kinyílnak.",https://poet.hu/vers/390215
poz,Voodoo,Szíveddel dobban,"Minden versed kotta, hullámzó dallam, amitől sötét egem lángra lobban, hallom szívdobbanásod, lüktet lassan, mintha itt tartanálak a karomban. Lejátszom újra és újra, hogy halljam, ott lebeg halkan mindegyik dalomban, játszom napfényben, esőben és fagyban, szívem szíveddel dobban mellkasomban. Távol vagy, de sohasem hagysz egyedül, a széllel üzensz, most is épp hegedül, veled alszik el, s veled ébred a fény. Zenémben, nem titok, ott él a remény, néha elkerül, de mindig visszatér... Leül melléd, rád mosolyog, s elrepül...",https://poet.hu/vers/389955
OFF,Bera Irén,Mi lenne?,"Kíváncsiság kifúrja az oldalamat. Vajon mi lenne, átfesteném hajamat? Ha váltok sötétre, mondjuk feketére. Lehet, hogy én lennék a gyerekek réme. Vagy hatalmasra hízok, mint egy luftballon. S szünet nélkül ennék, egyszer szétpukkadok. Nem tudnám felvenni a farmernadrágomat, Mivel takarnám be lógó, hájas hasamat? Nadrág, ha be nem érne, az világ vége... Akkor velem többet senki nem beszélne? Vajon mindenki elkerülne? Fejem felett csak felhő gyűlne? Nap engem velük kikacagna? A szívem talán megszakadna... Fekete hajú, kövér banya, Magányában unatkozna. Folyton azért siránkozna, Régi énjét kapja vissza.",https://poet.hu/vers/389646
OFF,Várady Endre,Két eset lehetséges,"Vagy az Úr teremtett meg minket, vagy mi teremtettük meg őt magunknak. A második esetben a mindenható kegyelmezzen nekünk!",https://poet.hu/vers/389544
OFF,Csirke Zoltán,"Alulról, és befelé","Felelősen úgy döntöttem, székletemet tesztelem, ám miután postán hagytam, kakimintám elveszett. Módosítva projektemen, időpontot foglaltam, prevenciós programomat rendelésen folytattam. Odaadtam az alfelem, tükrözzék meg a belem, levegőt is fújtak hozzá, lufi lettem hirtelen. Simább legyen a hatolás vazelinnel bekentek, kloákámból huncut hangok önkéntelen repkedtek. Akadozott bennem a cső, néha megtört az útja, másfél méter bújás során gondoltam már az Úrra. Hempergettek jobbról balra, helyezgették testemet, jódolgomban monitoron mélymagammal szemeztem. Csillapított gyönyört, szépet e fent leírt jelenet, de nyugtató az eredmény, polip, rák még nincs velem. Következik dülmirigyem, noha nem vagyok tata, hadd működjön (jó méretben) száz évig a prosztata. Fontos dolog a vizsgálat, míg ad időt Teremtőm, lépéselőny, mint a sakkban: stratégiám így nyerőbb.",https://poet.hu/vers/389151
poz,Termeczky Balázs,Mosolygás ereje,"Mosolygás egy olyan dolog, Mely szájjal simogatjuk Más lelkét, mely olyan, Mint a virág kinyílik a réten, Mely szépséget hoz, és boldogságot teremt. Boldognak lenni, másokkal Nem foglalkozva, csak élvezve A pillanat varázsát, mely körülvesz, Minden mosoly egy új kezdet, egy új lehetőség. Mert a mosoly ereje, mint a napfény, Mely felmelegíti a szíveket, és elűzi a felhőket, Egy egyszerű gesztus, de hatalmas ajándék, Mely összeköti a lelkeket, és boldogságot teremt. Mosolygás egy olyan dolog, Mely szavak nélkül is beszél, Egy híd, mi összeköt minket, S a világot szebbé teszi, ha együtt nevetünk. Mikor megsimogatja a szél a testemet Egy forró nyári napon, olyan, mint Ha simogatná lelkemet selymesen, Mely mosolyt csal arcomra. Este csillagokat nézve, Mely csillagok egy mosolygós Arcot mutatva állnak, mely Családomra emlékeztet.",https://poet.hu/vers/389077
